{
  "cycle_id": "CYCLE-000021",
  "audited_commit": "1cca3f648c25af1fc22a98a11d4319fa488aa4eb",
  "runner": "codex-cli",
  "model": "gpt-5.6-sol",
  "prompt_sha256": "a317d423c9a6791b5fc2c82d692202d282a2770ed6a728960d89a8d770926400",
  "started_at": "2026-08-03T06:07:54Z",
  "completed_at": "2026-08-03T06:12:38Z",
  "policy_bundle": {
    "checks_sha256": "c6878bc9b1d44fb7b4058189fd42c7d02532fd13e74d3c518855cfc5b75df28c",
    "constitution_sha256": "0dbdc5579f414453dc65c864764798c51bbbe2ebd46ae1d29c96a4e52f3dad00",
    "rulebook_sha256": "86c911eb6b0730442d706f8a5567e50a70815958c4e6b4508573031512c6d512",
    "rulebook_version": "1.0.0"
  }
}
