{
  "cycle_id": "CYCLE-000013",
  "audited_commit": "c1c6bac94a22f38433a1abb8197839581b69e848",
  "runner": "codex-cli",
  "model": "gpt-5",
  "prompt_sha256": "6e3036e276ca14509fbc043fa8daa7d5c6ecfc2442557d57c96ea82e65626b84",
  "started_at": "2026-08-03T01:54:52Z",
  "completed_at": "2026-08-03T02:06:59Z",
  "policy_bundle": {
    "checks_sha256": "c6878bc9b1d44fb7b4058189fd42c7d02532fd13e74d3c518855cfc5b75df28c",
    "constitution_sha256": "0dbdc5579f414453dc65c864764798c51bbbe2ebd46ae1d29c96a4e52f3dad00",
    "rulebook_sha256": "86c911eb6b0730442d706f8a5567e50a70815958c4e6b4508573031512c6d512",
    "rulebook_version": "1.0.0"
  }
}
