{
  "cycle_id": "CYCLE-000019",
  "audited_commit": "a6bddfe82224c6b952257ea4a321abb6ff6879d7",
  "runner": "codex-cli",
  "model": "gpt-5",
  "prompt_sha256": "d05d164e477fbac25e2292bc9324a718e5f023bd7b080e4603af1691ee8ee08b",
  "started_at": "2026-08-03T05:12:17Z",
  "completed_at": "2026-08-03T05:19:16Z",
  "policy_bundle": {
    "checks_sha256": "c6878bc9b1d44fb7b4058189fd42c7d02532fd13e74d3c518855cfc5b75df28c",
    "constitution_sha256": "0dbdc5579f414453dc65c864764798c51bbbe2ebd46ae1d29c96a4e52f3dad00",
    "rulebook_sha256": "86c911eb6b0730442d706f8a5567e50a70815958c4e6b4508573031512c6d512",
    "rulebook_version": "1.0.0"
  }
}
