{
  "cycle_id": "CYCLE-000027",
  "audited_commit": "ad8757317e6a1b6aaa31d640e837bc64da2c7717",
  "runner": "codex-cli",
  "model": "gpt-5.6",
  "prompt_sha256": "530da74a3e7a15203b2a7dc6fabe623ebf338f13bd0915a100920d2714a80603",
  "started_at": "2026-08-04T02:55:00Z",
  "completed_at": "2026-08-04T02:58:28Z",
  "policy_bundle": {
    "checks_sha256": "c6878bc9b1d44fb7b4058189fd42c7d02532fd13e74d3c518855cfc5b75df28c",
    "constitution_sha256": "0dbdc5579f414453dc65c864764798c51bbbe2ebd46ae1d29c96a4e52f3dad00",
    "rulebook_sha256": "86c911eb6b0730442d706f8a5567e50a70815958c4e6b4508573031512c6d512",
    "rulebook_version": "1.0.0"
  }
}
