{
  "cycle_id": "CYCLE-000004",
  "audited_commit": "746564b69191a91a41536bf0d9aa870220cda408",
  "runner": "codex-cli",
  "model": "gpt-5.6",
  "prompt_sha256": "f36f701454255b95a1de8392934ed1e6325627b4928d1d0a40b90786d1d080a4",
  "started_at": "2026-07-31T03:57:26Z",
  "completed_at": "2026-07-31T04:03:02Z",
  "policy_bundle": {
    "checks_sha256": "c6878bc9b1d44fb7b4058189fd42c7d02532fd13e74d3c518855cfc5b75df28c",
    "constitution_sha256": "0dbdc5579f414453dc65c864764798c51bbbe2ebd46ae1d29c96a4e52f3dad00",
    "rulebook_sha256": "86c911eb6b0730442d706f8a5567e50a70815958c4e6b4508573031512c6d512",
    "rulebook_version": "1.0.0"
  }
}
