{
  "cycle_id": "CYCLE-000009",
  "audited_commit": "a75e2f7f2d0d4de113674aeb2a5490e1c79bfcd5",
  "runner": "codex-cli",
  "model": "gpt-5",
  "prompt_sha256": "4a3f2e6ec398dcb611ad12c385589e389d7cb4fbf25cec733dd7724c12e77bad",
  "started_at": "2026-07-31T15:57:10Z",
  "completed_at": "2026-07-31T16:01:08Z",
  "policy_bundle": {
    "checks_sha256": "c6878bc9b1d44fb7b4058189fd42c7d02532fd13e74d3c518855cfc5b75df28c",
    "constitution_sha256": "0dbdc5579f414453dc65c864764798c51bbbe2ebd46ae1d29c96a4e52f3dad00",
    "rulebook_sha256": "86c911eb6b0730442d706f8a5567e50a70815958c4e6b4508573031512c6d512",
    "rulebook_version": "1.0.0"
  }
}
