{
  "cycle_id": "CYCLE-000022",
  "audited_commit": "54861ef2b9fdbe90c81c991daf79e161f5da003f",
  "runner": "codex-cli",
  "model": "gpt-5",
  "prompt_sha256": "27d78648a3591d88ac2726c5a2e4e92f94536e4a4d4668434d962f61b58106df",
  "started_at": "2026-08-03T06:37:30Z",
  "completed_at": "2026-08-03T06:49:00Z",
  "policy_bundle": {
    "checks_sha256": "c6878bc9b1d44fb7b4058189fd42c7d02532fd13e74d3c518855cfc5b75df28c",
    "constitution_sha256": "0dbdc5579f414453dc65c864764798c51bbbe2ebd46ae1d29c96a4e52f3dad00",
    "rulebook_sha256": "86c911eb6b0730442d706f8a5567e50a70815958c4e6b4508573031512c6d512",
    "rulebook_version": "1.0.0"
  }
}
