{
  "cycle_id": "CYCLE-000025",
  "audited_commit": "7a4f3b0e2fcd3d02ac2d3712fd53cad6715fff88",
  "runner": "codex-cli",
  "model": "gpt-5",
  "prompt_sha256": "820d4ed243df30b892af374ff55947793de81a5ea1d2dc2b57d5d6efe8a016d6",
  "started_at": "2026-08-04T02:45:20Z",
  "completed_at": "2026-08-04T02:46:54Z",
  "policy_bundle": {
    "checks_sha256": "c6878bc9b1d44fb7b4058189fd42c7d02532fd13e74d3c518855cfc5b75df28c",
    "constitution_sha256": "0dbdc5579f414453dc65c864764798c51bbbe2ebd46ae1d29c96a4e52f3dad00",
    "rulebook_sha256": "86c911eb6b0730442d706f8a5567e50a70815958c4e6b4508573031512c6d512",
    "rulebook_version": "1.0.0"
  }
}
