{
  "cycle_id": "CYCLE-000011",
  "audited_commit": "c1e973cac911cba9efcbbb6966ca5eb8d1d12302",
  "runner": "codex-cli",
  "model": "gpt-5",
  "prompt_sha256": "638da578c44c78934412753cbe34c4b8e2a14e37646bc1028c2186267b923ad0",
  "started_at": "2026-08-02T16:40:30Z",
  "completed_at": "2026-08-02T16:44:11Z",
  "policy_bundle": {
    "checks_sha256": "c6878bc9b1d44fb7b4058189fd42c7d02532fd13e74d3c518855cfc5b75df28c",
    "constitution_sha256": "0dbdc5579f414453dc65c864764798c51bbbe2ebd46ae1d29c96a4e52f3dad00",
    "rulebook_sha256": "86c911eb6b0730442d706f8a5567e50a70815958c4e6b4508573031512c6d512",
    "rulebook_version": "1.0.0"
  }
}
