{
  "cycle_id": "CYCLE-000014",
  "audited_commit": "62160f0b05f1ff100ba570de3dcfa8a83597d22f",
  "runner": "codex-cli",
  "model": "gpt-5.6",
  "prompt_sha256": "abe2e463df55d13f9cfde687e1f2bbb56b9f04bf53e2daa95fae20223c18edc0",
  "started_at": "2026-08-03T02:18:37Z",
  "completed_at": "2026-08-03T02:23:04Z",
  "policy_bundle": {
    "checks_sha256": "c6878bc9b1d44fb7b4058189fd42c7d02532fd13e74d3c518855cfc5b75df28c",
    "constitution_sha256": "0dbdc5579f414453dc65c864764798c51bbbe2ebd46ae1d29c96a4e52f3dad00",
    "rulebook_sha256": "86c911eb6b0730442d706f8a5567e50a70815958c4e6b4508573031512c6d512",
    "rulebook_version": "1.0.0"
  }
}
