{
  "cycle_id": "CYCLE-000023",
  "audited_commit": "bc98bda31b8aaf4836e38b815ed66f90ef341fd3",
  "runner": "codex-cli",
  "model": "gpt-5.6",
  "prompt_sha256": "c3adcbb633517adf4451e88c672f2f1e34cd4482972ab45cb34e9f61350e21bf",
  "started_at": "2026-08-03T09:03:52Z",
  "completed_at": "2026-08-03T09:07:46Z",
  "policy_bundle": {
    "checks_sha256": "c6878bc9b1d44fb7b4058189fd42c7d02532fd13e74d3c518855cfc5b75df28c",
    "constitution_sha256": "0dbdc5579f414453dc65c864764798c51bbbe2ebd46ae1d29c96a4e52f3dad00",
    "rulebook_sha256": "86c911eb6b0730442d706f8a5567e50a70815958c4e6b4508573031512c6d512",
    "rulebook_version": "1.0.0"
  }
}
