{
  "cycle_id": "CYCLE-000006",
  "audited_commit": "4aed10a97d4858ef7b18dea940e6bf66294e2849",
  "runner": "codex-cli",
  "model": "gpt-5",
  "prompt_sha256": "1fc8ad437e96a03b040fd95594a922011775a5753bf32f60c31c19f1c5724485",
  "started_at": "2026-07-31T05:46:36Z",
  "completed_at": "2026-07-31T05:55:17Z",
  "policy_bundle": {
    "checks_sha256": "c6878bc9b1d44fb7b4058189fd42c7d02532fd13e74d3c518855cfc5b75df28c",
    "constitution_sha256": "0dbdc5579f414453dc65c864764798c51bbbe2ebd46ae1d29c96a4e52f3dad00",
    "rulebook_sha256": "86c911eb6b0730442d706f8a5567e50a70815958c4e6b4508573031512c6d512",
    "rulebook_version": "1.0.0"
  }
}
