{
  "cycle_id": "CYCLE-000015",
  "audited_commit": "c6372d99c5c3250d02b0308d517de9f1dee114fd",
  "runner": "codex-cli",
  "model": "gpt-5.6",
  "prompt_sha256": "eb632af8f6045caa83bc34e5e8b8b75d8cdaea56654c093d9ebfb02e09f3bf67",
  "started_at": "2026-08-03T02:24:05Z",
  "completed_at": "2026-08-03T02:29:14Z",
  "policy_bundle": {
    "checks_sha256": "c6878bc9b1d44fb7b4058189fd42c7d02532fd13e74d3c518855cfc5b75df28c",
    "constitution_sha256": "0dbdc5579f414453dc65c864764798c51bbbe2ebd46ae1d29c96a4e52f3dad00",
    "rulebook_sha256": "86c911eb6b0730442d706f8a5567e50a70815958c4e6b4508573031512c6d512",
    "rulebook_version": "1.0.0"
  }
}
