{
  "cycle_id": "CYCLE-000008",
  "audited_commit": "af0dc58713b9bcf675fb324a262024f39127f8a7",
  "runner": "codex-cli",
  "model": "gpt-5",
  "prompt_sha256": "4a54710077290b0592224c173ffd1f01f4dda09b350368ce4ac796453921b919",
  "started_at": "2026-07-31T07:45:53Z",
  "completed_at": "2026-07-31T07:54:40Z",
  "policy_bundle": {
    "checks_sha256": "c6878bc9b1d44fb7b4058189fd42c7d02532fd13e74d3c518855cfc5b75df28c",
    "constitution_sha256": "0dbdc5579f414453dc65c864764798c51bbbe2ebd46ae1d29c96a4e52f3dad00",
    "rulebook_sha256": "86c911eb6b0730442d706f8a5567e50a70815958c4e6b4508573031512c6d512",
    "rulebook_version": "1.0.0"
  }
}
