{
  "cycle_id": "CYCLE-000018",
  "audited_commit": "27dd4bd297ac4019928bb9334584643928d7b6d2",
  "runner": "codex-cli",
  "model": "gpt-5",
  "prompt_sha256": "4384fceb0757efc5cb401399a7e920c8d17862120af055560ace3c958e72b67d",
  "started_at": "2026-08-03T03:55:30Z",
  "completed_at": "2026-08-03T04:02:07Z",
  "policy_bundle": {
    "checks_sha256": "c6878bc9b1d44fb7b4058189fd42c7d02532fd13e74d3c518855cfc5b75df28c",
    "constitution_sha256": "0dbdc5579f414453dc65c864764798c51bbbe2ebd46ae1d29c96a4e52f3dad00",
    "rulebook_sha256": "86c911eb6b0730442d706f8a5567e50a70815958c4e6b4508573031512c6d512",
    "rulebook_version": "1.0.0"
  }
}
