{
  "cycle_id": "CYCLE-000012",
  "audited_commit": "89db467e627b2c998a85e8e1ef01c50e170a3801",
  "runner": "codex-cli",
  "model": "gpt-5",
  "prompt_sha256": "623738a4422ef84a7b9559fb6b44223629a8e6e1325acfe5b87feff18bfd1422",
  "started_at": "2026-08-03T01:44:21Z",
  "completed_at": "2026-08-03T01:51:02Z",
  "policy_bundle": {
    "checks_sha256": "c6878bc9b1d44fb7b4058189fd42c7d02532fd13e74d3c518855cfc5b75df28c",
    "constitution_sha256": "0dbdc5579f414453dc65c864764798c51bbbe2ebd46ae1d29c96a4e52f3dad00",
    "rulebook_sha256": "86c911eb6b0730442d706f8a5567e50a70815958c4e6b4508573031512c6d512",
    "rulebook_version": "1.0.0"
  }
}
