{
  "cycle_id": "CYCLE-000017",
  "audited_commit": "39fb71f740505d342f0d1b1ec232744f5a7f0e8c",
  "runner": "codex-cli",
  "model": "gpt-5.6",
  "prompt_sha256": "b7d65890a58167d51087958103dbb9b66b2e327d7306628c78fa8c4ae5157af0",
  "started_at": "2026-08-03T03:19:30Z",
  "completed_at": "2026-08-03T03:37:45Z",
  "policy_bundle": {
    "checks_sha256": "c6878bc9b1d44fb7b4058189fd42c7d02532fd13e74d3c518855cfc5b75df28c",
    "constitution_sha256": "0dbdc5579f414453dc65c864764798c51bbbe2ebd46ae1d29c96a4e52f3dad00",
    "rulebook_sha256": "86c911eb6b0730442d706f8a5567e50a70815958c4e6b4508573031512c6d512",
    "rulebook_version": "1.0.0"
  }
}
