{
  "cycle_id": "CYCLE-000016",
  "audited_commit": "a9c5f0f5c90afd9036f900bcd31a43b103225874",
  "runner": "codex-cli",
  "model": "GPT-5",
  "prompt_sha256": "fccb4a5bcff857f1cbfafef2b62b1de390af3a20c4bb96ae0a54f2859ddae019",
  "started_at": "2026-08-03T02:47:05Z",
  "completed_at": "2026-08-03T02:53:02Z",
  "policy_bundle": {
    "checks_sha256": "c6878bc9b1d44fb7b4058189fd42c7d02532fd13e74d3c518855cfc5b75df28c",
    "constitution_sha256": "0dbdc5579f414453dc65c864764798c51bbbe2ebd46ae1d29c96a4e52f3dad00",
    "rulebook_sha256": "86c911eb6b0730442d706f8a5567e50a70815958c4e6b4508573031512c6d512",
    "rulebook_version": "1.0.0"
  }
}
